{
  "contract_id": "audiencelab.android_sdk.integration",
  "contract_version": "1.0.0",
  "schema_ref": "android-sdk.integration.v1.schema.json",
  "issue_refs": [
    "GEE-518",
    "GEE-481"
  ],
  "platform": "native_android",
  "status": "published",
  "published_at": "2026-09-06",
  "summary": "Agent-verifiable native Android integration contract for AudienceLabSDK. Deterministic package identity, install steps, required signals, consent behavior, diagnostics, credential handoff rules, rollback, and machine-checkable verification evidence.",
  "sdk": {
    "product_name": "AudienceLab Android SDK",
    "module_name": "AudienceLabSDK",
    "public_api_root": "app.geeklab.audiencelab.sdk",
    "sdk_type": "native_android",
    "version": "1.1.11",
    "version_tag": "android-v1.1.11",
    "maven_coordinates": "ai.audiencelab:audiencelab-android-sdk:1.1.11",
    "maven_group_id": "ai.audiencelab",
    "maven_artifact_id": "audiencelab-android-sdk",
    "min_sdk": 23,
    "target_sdk": 36,
    "default_base_url": "https://analytics.geeklab.app",
    "endpoints": {
      "fetch_token": "/fetch-token",
      "webhook": "/webhook"
    },
    "api_key_header": "geeklab-api-key",
    "repository": {
      "git_url": "https://github.com/Geeklab-Ltd/audiencelab_android_sdk.git",
      "https_url": "https://github.com/Geeklab-Ltd/audiencelab_android_sdk",
      "authority": "Geeklab-Ltd/audiencelab_android_sdk",
      "default_branch": "main",
      "github_packages_url": "https://maven.pkg.github.com/geeklab-ltd/audiencelab_android_sdk"
    },
    "version_sources": [
      {
        "path": "contracts/android-sdk.integration.v1.json",
        "field": "sdk.version"
      },
      {
        "path": "README.md",
        "field": "documented SDK version 1.1.11"
      },
      {
        "path": "CHANGELOG.md",
        "field": "## [1.1.11]"
      },
      {
        "path": "GitHub Release android-v1.1.11 AAR BuildConfig.SDK_VERSION",
        "field": "1.1.11"
      }
    ],
    "distribution": [
      {
        "id": "gradle_github_packages",
        "name": "Gradle / GitHub Packages",
        "recommended": true,
        "coordinates": "ai.audiencelab:audiencelab-android-sdk:1.1.11",
        "repository_url": "https://maven.pkg.github.com/geeklab-ltd/audiencelab_android_sdk"
      },
      {
        "id": "manual_aar",
        "name": "Manual AAR",
        "recommended": false,
        "asset_name": "audiencelab-sdk-release-1.1.11.aar",
        "notes": "Download from the matching GitHub Release when package-feed access is unavailable."
      }
    ]
  },
  "install_steps": [
    {
      "id": "obtain_credential",
      "order": 1,
      "title": "Obtain environment-scoped API key via one-time handoff",
      "required": true,
      "details": [
        "Retrieve the AudienceLab application API key through the approved one-time/direct handoff channel for the entitled workspace and app environment (GEE-481).",
        "Store the key in the host app secret store / CI secret store / Gradle secret-backed BuildConfig. Never commit the raw key to source control.",
        "Never write the raw key into transcripts, ordinary logs, analytics events, or shared audit payloads.",
        "Sandbox and production keys are distinct. Sandbox never implies analysis-ready."
      ]
    },
    {
      "id": "add_package",
      "order": 2,
      "title": "Add AudienceLab Android SDK to the app module",
      "required": true,
      "preferred_method": "gradle_github_packages",
      "methods": {
        "gradle_github_packages": [
          "Add Maven repository https://maven.pkg.github.com/geeklab-ltd/audiencelab_android_sdk with gpr.user / gpr.key from Gradle properties or CI secrets.",
          "Add implementation(\"ai.audiencelab:audiencelab-android-sdk:1.1.11\").",
          "Do not use dynamic version ranges (+ / latest)."
        ],
        "manual_aar": [
          "Download audiencelab-sdk-release-1.1.11.aar from release android-v1.1.11.",
          "Place under app/libs/ and add implementation(files(\"libs/audiencelab-sdk-release-1.1.11.aar\"))."
        ]
      }
    },
    {
      "id": "manifest_requirements",
      "order": 3,
      "title": "Declare required AndroidManifest entries",
      "required": true,
      "details": [
        "Ensure <uses-permission android:name=\"android.permission.INTERNET\" /> is present.",
        "No additional permissions are required to initialize the SDK."
      ]
    },
    {
      "id": "initialize_sdk",
      "order": 4,
      "title": "Initialize SDK early in Application startup",
      "required": true,
      "code_ref": "docs/AGENT_VERIFIABLE_INTEGRATION.md#initialize",
      "api": "AudienceLabSDK.initialize(context, apiKey, options)",
      "details": [
        "Call initialize before sending events.",
        "Use isDevelopmentMode=true for sandbox/dev traffic; false for production builds under certification.",
        "Default autoResolveGooglePlayIds=true unless restricted-network or consent constraints require false."
      ]
    },
    {
      "id": "emit_required_signals",
      "order": 5,
      "title": "Emit required signals for certification",
      "required": true,
      "details": [
        "Confirm creative token acquisition after initialize (TokenDebugSnapshot.hasValidToken or getCreativeToken()).",
        "Allow automatic session and retention signals to flow.",
        "Emit at least one integrator event (custom, custom.ad, or custom.purchase) accepted in the target environment."
      ]
    },
    {
      "id": "consent_gates",
      "order": 6,
      "title": "Apply host consent gates for advertising identifiers",
      "required": true,
      "details": [
        "Host owns Play Data safety declarations and advertising-ID consent UX.",
        "When consent is unavailable or Play Services lookup may stall, set autoResolveGooglePlayIds=false and supply identifiers only through consented setters/providers.",
        "Blacklisted email/phone properties are SHA-256 hashed by the SDK."
      ]
    },
    {
      "id": "verify_locally",
      "order": 7,
      "title": "Run machine-checkable verification evidence",
      "required": true,
      "command": "python3 scripts/verify_android_integration_contract.py",
      "evidence_path": "verification/evidence/latest.json"
    }
  ],
  "public_api": {
    "initialize": "AudienceLabSDK.initialize(context: Context, apiKey: String, options: AudienceLabOptions = AudienceLabOptions()): Boolean",
    "required_entrypoints": [
      "AudienceLabSDK.initialize(context, apiKey, options)",
      "AudienceLabSDK.isInitialized()",
      "AudienceLabSDK.getCreativeToken()",
      "AudienceLabSDK.sendAdEvent(...)",
      "AudienceLabSDK.sendPurchaseEvent(...)",
      "AudienceLabSDK.sendCustomEvent(...)",
      "AudienceLabSDK.setSdkEnabled(Boolean)",
      "AudienceLabSDK.toggleMetricsCollection(Boolean)",
      "AudienceLabSDK.setDebugEnabled(Boolean)",
      "AudienceLabSDK.getSdkVersion()",
      "AudienceLabSDK.getTokenDebugSnapshot()",
      "AudienceLabSDK.getIdentityDebugSnapshot()",
      "AudienceLabSDK.getDeviceDebugSnapshot()",
      "AudienceLabSDK.getQueueDebugSnapshot()",
      "AudienceLabSDK.getConfiguredApiKeyPreview()",
      "AudienceLabSDK.getRevenueCatAttributes()"
    ],
    "options_type": "AudienceLabOptions",
    "options_fields": [
      "isSdkEnabled",
      "isMetricsEnabled",
      "isDebugEnabled",
      "isDevelopmentMode",
      "appVersion",
      "baseUrl",
      "autoResolveGooglePlayIds"
    ]
  },
  "credentials": {
    "kind": "application_api_key",
    "header_name": "geeklab-api-key",
    "environments": [
      "sandbox",
      "production"
    ],
    "handoff": {
      "mode": "one_time_or_direct",
      "agent_may_retrieve": true,
      "scope": "entitled_workspace_app_only",
      "cross_tenant_forbidden": true,
      "prefer_short_lived_retrieval": true,
      "never_persist_in": [
        "git",
        "mcp_transcripts",
        "ordinary_logs",
        "analytics_events",
        "shared_audit_payloads"
      ],
      "audit_may_record": [
        "issuance_metadata",
        "use_metadata",
        "rotation_metadata",
        "presence_confirmation"
      ]
    },
    "injection": {
      "runtime_only": true,
      "initialize_parameter": "apiKey",
      "recommended_mechanisms": [
        "CI secret -> BuildConfig field",
        "Gradle local.properties / secret store (never committed)",
        "Host sealed config"
      ],
      "forbidden_patterns": [
        "hardcoded key literals in app source committed to git",
        "keys in AndroidManifest.xml committed to git",
        "keys in README examples beyond placeholders"
      ],
      "placeholder": "YOUR_AUDIENCELAB_API_KEY",
      "redacted_preview_api": "AudienceLabSDK.getConfiguredApiKeyPreview()"
    },
    "production_gate": "Requires grant scope plus app state checks; sandbox never implies analysis-ready."
  },
  "required_signals": {
    "policy_ref": "GEE-481",
    "analysis_ready_requires": [
      "production_or_approved_prod_like_credentials_bound",
      "sdk_attested",
      "accepted_production_signals_observed",
      "freshness_within_policy_window",
      "no_blocking_validation_failures"
    ],
    "automatic": [
      {
        "id": "session_lifecycle",
        "event_types": [
          "session"
        ],
        "emitter": "sdk",
        "required_for_certification": true,
        "notes": "Session start/end with 30-minute timeout after initialize when metrics are enabled."
      },
      {
        "id": "retention",
        "event_types": [
          "retention"
        ],
        "emitter": "sdk",
        "required_for_certification": true,
        "notes": "Retention markers; first-launch day is 0; retention_day included on webhook envelopes."
      },
      {
        "id": "creative_token",
        "signal": "creative_token_acquired",
        "emitter": "sdk",